concept_id,concept_name,domain_id,vocabulary_id,concept_class_id,standard_concept,concept_code,valid_start_date,valid_end_date,invalid_reason
35614248,SeQuent Please 5022225 drug-eluting coronary angioplasty balloon catheter 3.5mm x 20mm (B.Braun Medical Ltd),Device,SNOMED,Physical Object,S,13054401000001103,2017-06-21,2099-12-31,
35614249,SeQuent Please 5022227 drug-eluting coronary angioplasty balloon catheter 4.0mm x 20mm (B.Braun Medical Ltd),Device,SNOMED,Physical Object,S,13054501000001104,2017-06-21,2099-12-31,
35614250,SeQuent Please 5022230 drug-eluting coronary angioplasty balloon catheter 2.5mm x 26mm (B.Braun Medical Ltd),Device,SNOMED,Physical Object,S,13054601000001100,2017-06-21,2099-12-31,
35614251,SeQuent Please 5022231 drug-eluting coronary angioplasty balloon catheter 2.75mm x 26mm (B.Braun Medical Ltd),Device,SNOMED,Physical Object,S,13054701000001105,2017-06-21,2099-12-31,
35614252,SeQuent Please 5022232 drug-eluting coronary angioplasty balloon catheter 3.0mm x 26mm (B.Braun Medical Ltd),Device,SNOMED,Physical Object,S,13054801000001101,2017-06-21,2099-12-31,
35614253,SeQuent Please 5022234 drug-eluting coronary angioplasty balloon catheter 3.5mm x 26mm (B.Braun Medical Ltd),Device,SNOMED,Physical Object,S,13054901000001107,2017-06-21,2099-12-31,
35614254,SeQuent Please 5022240 drug-eluting coronary angioplasty balloon catheter 2.5mm x 30mm (B.Braun Medical Ltd),Device,SNOMED,Physical Object,S,13055001000001107,2017-06-21,2099-12-31,
35614255,SeQuent Please 5022242 drug-eluting coronary angioplasty balloon catheter 3.0mm x 30mm (B.Braun Medical Ltd),Device,SNOMED,Physical Object,S,13055101000001108,2017-06-21,2099-12-31,
35614256,SeQuent Please 5022243 drug-eluting coronary angioplasty balloon catheter 3.5mm x 30mm (B.Braun Medical Ltd),Device,SNOMED,Physical Object,S,13055201000001101,2017-06-21,2099-12-31,
4031850,Coronary angioplasty by open chest approach,Procedure,SNOMED,Procedure,S,14201006,2002-01-31,2099-12-31,
4328103,Infusion of intra-arterial thrombolytic agent with percutaneous transluminal coronary angioplasty,Procedure,SNOMED,Procedure,S,75761004,2002-01-31,2099-12-31,
35607959,Percutaneous transluminal angioplasty of coronary artery using drug eluting balloon catheter,Procedure,SNOMED,Procedure,S,763725002,2018-07-31,2099-12-31,
4295146,"Hospital admission, for observation",Observation,SNOMED,Procedure,S,76464004,2002-01-31,2099-12-31,
44805202,Transthoracic echocardiography for complex congenital heart disease,Procedure,SNOMED,Procedure,S,772531000000105,2011-04-01,2099-12-31,
44805203,Transoesophageal echocardiography for complex congenital heart disease,Procedure,SNOMED,Procedure,S,772551000000103,2011-04-01,2099-12-31,
44805204,Transluminal intracardiac echocardiography for complex congenital heart disease,Procedure,SNOMED,Procedure,S,772571000000107,2011-04-01,2099-12-31,
37206167,Saline contrast echocardiogram,Procedure,SNOMED,Procedure,S,785775005,2019-07-31,2099-12-31,
4216356,"Infusion of intra-arterial thrombolytic agent with percutaneous transluminal coronary angioplasty, multiple vessels",Procedure,SNOMED,Procedure,S,80762004,2002-01-31,2099-12-31,
4305021,Echocardiography for detecting cardiac output,Procedure,SNOMED,Procedure,S,8151003,2002-01-31,2099-12-31,
37311810,Stress echocardiography,Procedure,SNOMED,Procedure,S,816996009,2020-01-31,2099-12-31,
37311809,Echocardiography using pharmacologic stress agent,Procedure,SNOMED,Procedure,S,816997000,2020-01-31,2099-12-31,
3654311,Velocity vector imaging echocardiography,Procedure,SNOMED,Procedure,S,830078000,2020-07-31,2099-12-31,
3654312,Speckle tracking echocardiography,Procedure,SNOMED,Procedure,S,830079008,2020-07-31,2099-12-31,
4307818,Echocardiography for determining mitral valve motion,Procedure,SNOMED,Procedure,S,83061004,2002-01-31,2099-12-31,
3661502,Acute ST segment elevation myocardial infarction due to proximal left anterior descending coronary artery occlusion,Condition,SNOMED,Clinical Finding,S,840309000,2020-07-31,2099-12-31,
3661503,Acute ST segment elevation myocardial infarction due to mid left anterior descending coronary artery occlusion,Condition,SNOMED,Clinical Finding,S,840312002,2020-07-31,2099-12-31,
3661504,Acute ST segment elevation myocardial infarction due to distal left anterior descending coronary artery occlusion,Condition,SNOMED,Clinical Finding,S,840316004,2020-07-31,2099-12-31,
3661520,Acute ST segment elevation myocardial infarction due to occlusion of anterior descending branch of left coronary artery,Condition,SNOMED,Clinical Finding,S,840609007,2020-07-31,2099-12-31,
3661524,Acute ST segment elevation myocardial infarction due to occlusion of septal branch of anterior descending branch of left coronary artery,Condition,SNOMED,Clinical Finding,S,840680009,2020-07-31,2099-12-31,
3661525,Everolimus 100 microgram/cm2 drug eluting stent,Device,SNOMED,Pharma/Biol Product,S,840700004,2020-07-31,2099-12-31,
3661530,Zotarolimus 1.6 microgram/mm2 drug eluting stent,Device,SNOMED,Pharma/Biol Product,S,846592008,2020-07-31,2099-12-31,
3661547,Acute ST segment elevation myocardial infarction due to occlusion of diagonal branch of anterior descending branch of left coronary artery,Condition,SNOMED,Clinical Finding,S,846668006,2020-07-31,2099-12-31,
4225903,"Percutaneous transluminal coronary angioplasty, multiple vessels",Procedure,SNOMED,Procedure,S,85053006,2002-01-31,2099-12-31,
44809812,Fluoroscopy guided percutaneous transluminal repair of mitral valve leaflet using transoesophageal echocardiography,Procedure,SNOMED,Procedure,S,865051000000105,2013-04-01,2099-12-31,
3661641,Acute ST segment elevation myocardial infarction due to occlusion of proximal portion of right coronary artery,Condition,SNOMED,Clinical Finding,S,868214006,2020-07-31,2099-12-31,
3661642,Acute ST segment elevation myocardial infarction due to occlusion of distal portion of right coronary artery,Condition,SNOMED,Clinical Finding,S,868217004,2020-07-31,2099-12-31,
3661643,Acute ST segment elevation myocardial infarction due to occlusion of mid portion of right coronary artery,Condition,SNOMED,Clinical Finding,S,868220007,2020-07-31,2099-12-31,
3661644,Acute ST segment elevation myocardial infarction due to occlusion of marginal branch of right coronary artery,Condition,SNOMED,Clinical Finding,S,868224003,2020-07-31,2099-12-31,
3661645,Acute ST segment elevation myocardial infarction due to occlusion of posterior descending branch of right coronary artery,Condition,SNOMED,Clinical Finding,S,868225002,2020-07-31,2099-12-31,
3661646,Acute ST segment elevation myocardial infarction due to occlusion of posterior lateral branch of right coronary artery,Condition,SNOMED,Clinical Finding,S,868226001,2020-07-31,2099-12-31,
3655773,Percutaneous coronary intervention of left coronary artery,Procedure,SNOMED,Procedure,S,868245005,2020-07-31,2099-12-31,
3655774,Percutaneous coronary intervention of anterior descending branch of left coronary artery,Procedure,SNOMED,Procedure,S,868246006,2020-07-31,2099-12-31,
3655775,Percutaneous coronary intervention of circumflex branch of left coronary artery,Procedure,SNOMED,Procedure,S,868247002,2020-07-31,2099-12-31,
3655776,Percutaneous coronary intervention of right coronary artery,Procedure,SNOMED,Procedure,S,868248007,2020-07-31,2099-12-31,
3661699,Paclitaxel 1 microgram/mm2 drug eluting stent,Device,SNOMED,Pharma/Biol Product,S,870369006,2020-07-31,2099-12-31,
3661700,Sirolimus 140 microgram/cm2 drug eluting stent,Device,SNOMED,Pharma/Biol Product,S,870370007,2020-07-31,2099-12-31,
604427,Acute ST segment elevation myocardial infarction due to occlusion of circumflex branch of left coronary artery,Condition,SNOMED,Clinical Finding,S,896691006,2021-01-31,2099-12-31,
604429,Acute ST segment elevation myocardial infarction of apex of heart,Condition,SNOMED,Clinical Finding,S,896696001,2021-01-31,2099-12-31,
604430,Acute ST segment elevation myocardial infarction of right ventricle,Condition,SNOMED,Clinical Finding,S,896697005,2021-01-31,2099-12-31,
4238755,"Infusion of intra-arterial thrombolytic agent with percutaneous transluminal coronary angioplasty, single vessel",Procedure,SNOMED,Procedure,S,91338001,2002-01-31,2099-12-31,
44811692,Fluoroscopy guided primary percutaneous coronary intervention,Procedure,SNOMED,Procedure,S,914231000000100,2014-04-01,2099-12-31,
45770795,Percutaneous transluminal balloon angioplasty and insertion of drug eluting stent into coronary artery,Procedure,SNOMED,Procedure,S,936451000000108,2014-10-01,2099-12-31,
4316729,Ultrasonic guidance for endomyocardial biopsy,Procedure,SNOMED,Procedure,S,951000,2002-01-31,2099-12-31,
42599784,Systolic anterior motion of mitral valve,Condition,SNOMED Veterinary,Clinical Finding,S,359231000009100,2017-03-28,2099-12-31,
42599785,Spontaneous echo contrast,Condition,SNOMED Veterinary,Clinical Finding,S,359241000009106,2017-03-28,2099-12-31,
44511133,Other specified transluminal balloon angioplasty of coronary artery,Procedure,OPCS4,Procedure,S,K49.8,1970-01-01,2099-12-31,
44511268,Percutaneous transluminal balloon angioplasty and insertion of 1-2 drug-eluting stents into coronary artery,Procedure,OPCS4,Procedure,S,K75.1,1970-01-01,2099-12-31,
44511269,Percutaneous transluminal balloon angioplasty and insertion of 3 or more drug-eluting stents into coronary artery,Procedure,OPCS4,Procedure,S,K75.2,1970-01-01,2099-12-31,
44511270,Percutaneous transluminal balloon angioplasty and insertion of 1-2 stents into coronary artery,Procedure,OPCS4,Procedure,S,K75.3,1970-01-01,2099-12-31,
44511271,Percutaneous transluminal balloon angioplasty and insertion of 3 or more stents into coronary artery NEC,Procedure,OPCS4,Procedure,S,K75.4,1970-01-01,2099-12-31,
44511272,Other specified percutaneous transluminal balloon angioplasty and insertion of stent into coronary artery,Procedure,OPCS4,Procedure,S,K75.8,1970-01-01,2099-12-31,
44514109,Other specified diagnostic Echocardiography,Procedure,OPCS4,Procedure,S,U20.8,1970-01-01,2099-12-31,
38003097,Leave of Absence - Nursing home ( for hospitalization),Revenue Code,Revenue Code,Revenue Code,S,0185,1970-01-01,2099-12-31,
38003105,Intensive Care - General Classification,Revenue Code,Revenue Code,Revenue Code,S,0200,1970-01-01,2099-12-31,
38003106,Intensive Care - Surgical,Revenue Code,Revenue Code,Revenue Code,S,0201,1970-01-01,2099-12-31,
38003107,Intensive Care - Medical,Revenue Code,Revenue Code,Revenue Code,S,0202,1970-01-01,2099-12-31,
38003108,Intensive Care - Pediatric,Revenue Code,Revenue Code,Revenue Code,S,0203,1970-01-01,2099-12-31,
38003109,Intensive Care - Psychiatric,Revenue Code,Revenue Code,Revenue Code,S,0204,1970-01-01,2099-12-31,
38003110,Intensive Care - Post ICU,Revenue Code,Revenue Code,Revenue Code,S,0206,1970-01-01,2099-12-31,
38003111,Intensive Care - Burn Care,Revenue Code,Revenue Code,Revenue Code,S,0207,1970-01-01,2099-12-31,
38003112,Intensive Care - Trauma,Revenue Code,Revenue Code,Revenue Code,S,0208,1970-01-01,2099-12-31,
38003113,Intensive Care - Other Intensive Care,Revenue Code,Revenue Code,Revenue Code,S,0209,1970-01-01,2099-12-31,
38003273,Echocardiology,Revenue Code,Revenue Code,Revenue Code,S,0483,1970-01-01,2099-12-31,
38003380,Outpatient Special Residence Charges - Hospital based,Revenue Code,Revenue Code,Revenue Code,S,0671,1970-01-01,2099-12-31,
38003530,Professional Fees -Hospital Visit,Revenue Code,Revenue Code,Revenue Code,S,0987,1970-01-01,2099-12-31,
2787194,"Introduction of Other Thrombolytic into Coronary Artery, Percutaneous Approach",Procedure,ICD10PCS,ICD10PCS,S,3E07317,2014-04-22,2099-12-31,
2787195,"Introduction of Other Therapeutic Substance into Coronary Artery, Percutaneous Approach",Procedure,ICD10PCS,ICD10PCS,S,3E073GC,2014-04-22,2099-12-31,
2787196,"Introduction of Other Diagnostic Substance into Coronary Artery, Percutaneous Approach",Procedure,ICD10PCS,ICD10PCS,S,3E073KZ,2014-04-22,2099-12-31,
2787197,"Introduction of Platelet Inhibitor into Coronary Artery, Percutaneous Approach",Procedure,ICD10PCS,ICD10PCS,S,3E073PZ,2014-04-22,2099-12-31,
2785849,Ultrasonography of Single Coronary Artery using Other Contrast,Procedure,ICD10PCS,ICD10PCS,S,B240YZZ,2014-04-22,2099-12-31,
2785850,"Ultrasonography of Single Coronary Artery, Intravascular",Procedure,ICD10PCS,ICD10PCS,S,B240ZZ3,2014-04-22,2099-12-31,
2785851,"Ultrasonography of Single Coronary Artery, Transesophageal",Procedure,ICD10PCS,ICD10PCS,S,B240ZZ4,2014-04-22,2099-12-31,
2785852,Ultrasonography of Single Coronary Artery,Procedure,ICD10PCS,ICD10PCS,S,B240ZZZ,2014-04-22,2099-12-31,
2785853,Ultrasonography of Multiple Coronary Arteries using Other Contrast,Procedure,ICD10PCS,ICD10PCS,S,B241YZZ,2014-04-22,2099-12-31,
2785854,"Ultrasonography of Multiple Coronary Arteries, Intravascular",Procedure,ICD10PCS,ICD10PCS,S,B241ZZ3,2014-04-22,2099-12-31,
2785855,"Ultrasonography of Multiple Coronary Arteries, Transesophageal",Procedure,ICD10PCS,ICD10PCS,S,B241ZZ4,2014-04-22,2099-12-31,
2785856,Ultrasonography of Multiple Coronary Arteries,Procedure,ICD10PCS,ICD10PCS,S,B241ZZZ,2014-04-22,2099-12-31,
2786044,Ultrasonography of Right Heart using Other Contrast,Procedure,ICD10PCS,ICD10PCS,S,B244YZZ,2014-04-22,2099-12-31,
2786045,"Ultrasonography of Right Heart, Intravascular",Procedure,ICD10PCS,ICD10PCS,S,B244ZZ3,2014-04-22,2099-12-31,
2786046,"Ultrasonography of Right Heart, Transesophageal",Procedure,ICD10PCS,ICD10PCS,S,B244ZZ4,2014-04-22,2099-12-31,
2786047,Ultrasonography of Right Heart,Procedure,ICD10PCS,ICD10PCS,S,B244ZZZ,2014-04-22,2099-12-31,
2786048,Ultrasonography of Left Heart using Other Contrast,Procedure,ICD10PCS,ICD10PCS,S,B245YZZ,2014-04-22,2099-12-31,
2786049,"Ultrasonography of Left Heart, Intravascular",Procedure,ICD10PCS,ICD10PCS,S,B245ZZ3,2014-04-22,2099-12-31,
2786050,"Ultrasonography of Left Heart, Transesophageal",Procedure,ICD10PCS,ICD10PCS,S,B245ZZ4,2014-04-22,2099-12-31,
2786051,Ultrasonography of Left Heart,Procedure,ICD10PCS,ICD10PCS,S,B245ZZZ,2014-04-22,2099-12-31,
2786052,Ultrasonography of Right and Left Heart using Other Contrast,Procedure,ICD10PCS,ICD10PCS,S,B246YZZ,2014-04-22,2099-12-31,
2786053,"Ultrasonography of Right and Left Heart, Intravascular",Procedure,ICD10PCS,ICD10PCS,S,B246ZZ3,2014-04-22,2099-12-31,
2786054,"Ultrasonography of Right and Left Heart, Transesophageal",Procedure,ICD10PCS,ICD10PCS,S,B246ZZ4,2014-04-22,2099-12-31,
2786055,Ultrasonography of Right and Left Heart,Procedure,ICD10PCS,ICD10PCS,S,B246ZZZ,2014-04-22,2099-12-31,
2786056,Ultrasonography of Heart with Aorta using Other Contrast,Procedure,ICD10PCS,ICD10PCS,S,B24BYZZ,2014-04-22,2099-12-31,
2786057,"Ultrasonography of Heart with Aorta, Intravascular",Procedure,ICD10PCS,ICD10PCS,S,B24BZZ3,2014-04-22,2099-12-31,
2786058,"Ultrasonography of Heart with Aorta, Transesophageal",Procedure,ICD10PCS,ICD10PCS,S,B24BZZ4,2014-04-22,2099-12-31,
2786059,Ultrasonography of Heart with Aorta,Procedure,ICD10PCS,ICD10PCS,S,B24BZZZ,2014-04-22,2099-12-31,
2786060,Ultrasonography of Pericardium using Other Contrast,Procedure,ICD10PCS,ICD10PCS,S,B24CYZZ,2014-04-22,2099-12-31,
2786061,"Ultrasonography of Pericardium, Intravascular",Procedure,ICD10PCS,ICD10PCS,S,B24CZZ3,2014-04-22,2099-12-31,
2786062,"Ultrasonography of Pericardium, Transesophageal",Procedure,ICD10PCS,ICD10PCS,S,B24CZZ4,2014-04-22,2099-12-31,
2786063,Ultrasonography of Pericardium,Procedure,ICD10PCS,ICD10PCS,S,B24CZZZ,2014-04-22,2099-12-31,
2786064,Ultrasonography of Pediatric Heart using Other Contrast,Procedure,ICD10PCS,ICD10PCS,S,B24DYZZ,2014-04-22,2099-12-31,
2786065,"Ultrasonography of Pediatric Heart, Intravascular",Procedure,ICD10PCS,ICD10PCS,S,B24DZZ3,2014-04-22,2099-12-31,
2786066,"Ultrasonography of Pediatric Heart, Transesophageal",Procedure,ICD10PCS,ICD10PCS,S,B24DZZ4,2014-04-22,2099-12-31,
2786067,Ultrasonography of Pediatric Heart,Procedure,ICD10PCS,ICD10PCS,S,B24DZZZ,2014-04-22,2099-12-31,
2787377,"Ultrasonography of Thoracic Aorta, Intravascular",Procedure,ICD10PCS,ICD10PCS,S,B340ZZ3,2014-04-22,2099-12-31,
2787379,"Ultrasonography of Right Brachiocephalic-Subclavian Artery, Intravascular",Procedure,ICD10PCS,ICD10PCS,S,B341ZZ3,2014-04-22,2099-12-31,
2787571,"Ultrasonography of Left Subclavian Artery, Intravascular",Procedure,ICD10PCS,ICD10PCS,S,B342ZZ3,2014-04-22,2099-12-31,
2787573,"Ultrasonography of Right Common Carotid Artery, Intravascular",Procedure,ICD10PCS,ICD10PCS,S,B343ZZ3,2014-04-22,2099-12-31,
2787575,"Ultrasonography of Left Common Carotid Artery, Intravascular",Procedure,ICD10PCS,ICD10PCS,S,B344ZZ3,2014-04-22,2099-12-31,
2787577,"Ultrasonography of Bilateral Common Carotid Arteries, Intravascular",Procedure,ICD10PCS,ICD10PCS,S,B345ZZ3,2014-04-22,2099-12-31,
2787579,"Ultrasonography of Right Internal Carotid Artery, Intravascular",Procedure,ICD10PCS,ICD10PCS,S,B346ZZ3,2014-04-22,2099-12-31,
2787581,"Ultrasonography of Left Internal Carotid Artery, Intravascular",Procedure,ICD10PCS,ICD10PCS,S,B347ZZ3,2014-04-22,2099-12-31,
2787583,"Ultrasonography of Bilateral Internal Carotid Arteries, Intravascular",Procedure,ICD10PCS,ICD10PCS,S,B348ZZ3,2014-04-22,2099-12-31,
2787585,"Ultrasonography of Right Upper Extremity Arteries, Intravascular",Procedure,ICD10PCS,ICD10PCS,S,B34HZZ3,2014-04-22,2099-12-31,
2787587,"Ultrasonography of Left Upper Extremity Arteries, Intravascular",Procedure,ICD10PCS,ICD10PCS,S,B34JZZ3,2014-04-22,2099-12-31,
2787589,"Ultrasonography of Bilateral Upper Extremity Arteries, Intravascular",Procedure,ICD10PCS,ICD10PCS,S,B34KZZ3,2014-04-22,2099-12-31,
2787591,"Ultrasonography of Intracranial Arteries, Intravascular",Procedure,ICD10PCS,ICD10PCS,S,B34RZZ3,2014-04-22,2099-12-31,
2787593,"Ultrasonography of Right Pulmonary Artery, Intravascular",Procedure,ICD10PCS,ICD10PCS,S,B34SZZ3,2014-04-22,2099-12-31,
2787595,"Ultrasonography of Left Pulmonary Artery, Intravascular",Procedure,ICD10PCS,ICD10PCS,S,B34TZZ3,2014-04-22,2099-12-31,
2787597,"Ultrasonography of Ophthalmic Arteries, Intravascular",Procedure,ICD10PCS,ICD10PCS,S,B34VZZ3,2014-04-22,2099-12-31,
2788411,"Ultrasonography of Abdominal Aorta, Intravascular",Procedure,ICD10PCS,ICD10PCS,S,B440ZZ3,2014-04-22,2099-12-31,
2788609,"Ultrasonography of Superior Mesenteric Artery, Intravascular",Procedure,ICD10PCS,ICD10PCS,S,B444ZZ3,2014-04-22,2099-12-31,
2788611,"Ultrasonography of Inferior Mesenteric Artery, Intravascular",Procedure,ICD10PCS,ICD10PCS,S,B445ZZ3,2014-04-22,2099-12-31,
2788613,"Ultrasonography of Right Renal Artery, Intravascular",Procedure,ICD10PCS,ICD10PCS,S,B446ZZ3,2014-04-22,2099-12-31,
2788615,"Ultrasonography of Left Renal Artery, Intravascular",Procedure,ICD10PCS,ICD10PCS,S,B447ZZ3,2014-04-22,2099-12-31,
2788617,"Ultrasonography of Bilateral Renal Arteries, Intravascular",Procedure,ICD10PCS,ICD10PCS,S,B448ZZ3,2014-04-22,2099-12-31,
2788619,"Ultrasonography of Other Intra-Abdominal Arteries, Intravascular",Procedure,ICD10PCS,ICD10PCS,S,B44BZZ3,2014-04-22,2099-12-31,
2788621,"Ultrasonography of Right Lower Extremity Arteries, Intravascular",Procedure,ICD10PCS,ICD10PCS,S,B44FZZ3,2014-04-22,2099-12-31,
2788623,"Ultrasonography of Left Lower Extremity Arteries, Intravascular",Procedure,ICD10PCS,ICD10PCS,S,B44GZZ3,2014-04-22,2099-12-31,
2788625,"Ultrasonography of Bilateral Lower Extremity Arteries, Intravascular",Procedure,ICD10PCS,ICD10PCS,S,B44HZZ3,2014-04-22,2099-12-31,
2788627,"Ultrasonography of Celiac and Mesenteric Arteries, Intravascular",Procedure,ICD10PCS,ICD10PCS,S,B44KZZ3,2014-04-22,2099-12-31,
2788629,"Ultrasonography of Femoral Artery, Intravascular",Procedure,ICD10PCS,ICD10PCS,S,B44LZZ3,2014-04-22,2099-12-31,
2788631,"Ultrasonography of Penile Arteries, Intravascular",Procedure,ICD10PCS,ICD10PCS,S,B44NZZ3,2014-04-22,2099-12-31,
2786407,"Ultrasonography of Right Jugular Veins, Intravascular",Procedure,ICD10PCS,ICD10PCS,S,B543ZZ3,2014-04-22,2099-12-31,
2786410,"Ultrasonography of Left Jugular Veins, Intravascular",Procedure,ICD10PCS,ICD10PCS,S,B544ZZ3,2014-04-22,2099-12-31,
2786413,"Ultrasonography of Right Subclavian Vein, Intravascular",Procedure,ICD10PCS,ICD10PCS,S,B546ZZ3,2014-04-22,2099-12-31,
2786416,"Ultrasonography of Left Subclavian Vein, Intravascular",Procedure,ICD10PCS,ICD10PCS,S,B547ZZ3,2014-04-22,2099-12-31,
2786419,"Ultrasonography of Superior Vena Cava, Intravascular",Procedure,ICD10PCS,ICD10PCS,S,B548ZZ3,2014-04-22,2099-12-31,
2786422,"Ultrasonography of Inferior Vena Cava, Intravascular",Procedure,ICD10PCS,ICD10PCS,S,B549ZZ3,2014-04-22,2099-12-31,
2786425,"Ultrasonography of Right Lower Extremity Veins, Intravascular",Procedure,ICD10PCS,ICD10PCS,S,B54BZZ3,2014-04-22,2099-12-31,
2786617,"Ultrasonography of Left Lower Extremity Veins, Intravascular",Procedure,ICD10PCS,ICD10PCS,S,B54CZZ3,2014-04-22,2099-12-31,
2786620,"Ultrasonography of Bilateral Lower Extremity Veins, Intravascular",Procedure,ICD10PCS,ICD10PCS,S,B54DZZ3,2014-04-22,2099-12-31,
2786623,"Ultrasonography of Right Renal Vein, Intravascular",Procedure,ICD10PCS,ICD10PCS,S,B54JZZ3,2014-04-22,2099-12-31,
2786626,"Ultrasonography of Left Renal Vein, Intravascular",Procedure,ICD10PCS,ICD10PCS,S,B54KZZ3,2014-04-22,2099-12-31,
2786629,"Ultrasonography of Bilateral Renal Veins, Intravascular",Procedure,ICD10PCS,ICD10PCS,S,B54LZZ3,2014-04-22,2099-12-31,
2786632,"Ultrasonography of Right Upper Extremity Veins, Intravascular",Procedure,ICD10PCS,ICD10PCS,S,B54MZZ3,2014-04-22,2099-12-31,
2786635,"Ultrasonography of Left Upper Extremity Veins, Intravascular",Procedure,ICD10PCS,ICD10PCS,S,B54NZZ3,2014-04-22,2099-12-31,
2786638,"Ultrasonography of Bilateral Upper Extremity Veins, Intravascular",Procedure,ICD10PCS,ICD10PCS,S,B54PZZ3,2014-04-22,2099-12-31,
2786641,"Ultrasonography of Portal and Splanchnic Veins, Intravascular",Procedure,ICD10PCS,ICD10PCS,S,B54TZZ3,2014-04-22,2099-12-31,
44835459,"Single liveborn, born in hospital",Observation,ICD9CM,4-dig nonbill V code,,V30.0,1970-01-01,2099-12-31,
44833089,"Single liveborn, born in hospital, delivered without mention of cesarean section",Observation,ICD9CM,5-dig billing V code,,V30.00,1970-01-01,2099-12-31,
44826183,"Single liveborn, born in hospital, delivered by cesarean section",Observation,ICD9CM,5-dig billing V code,,V30.01,1970-01-01,2099-12-31,
44837806,"Single liveborn, born before admission to hospital",Condition,ICD9CM,4-dig billing V code,,V30.1,1970-01-01,2099-12-31,
44824998,"Single liveborn, born outside hospital and not hospitalized",Observation,ICD9CM,4-dig billing V code,,V30.2,1970-01-01,2099-12-31,
44824999,"Twin, mate liveborn, born in hospital",Condition,ICD9CM,4-dig nonbill V code,,V31.0,1970-01-01,2099-12-31,
44828529,"Twin birth, mate liveborn, born in hospital, delivered without mention of cesarean section",Condition,ICD9CM,5-dig billing V code,,V31.00,1970-01-01,2099-12-31,
44827347,"Twin birth, mate liveborn, born in hospital, delivered by cesarean section",Condition,ICD9CM,5-dig billing V code,,V31.01,1970-01-01,2099-12-31,
44821536,"Twin birth, mate liveborn, born before admission to hospital",Condition,ICD9CM,4-dig billing V code,,V31.1,1970-01-01,2099-12-31,
44823818,"Twin birth, mate stillborn, born in hospital, delivered without mention of cesarean section",Condition,ICD9CM,5-dig billing V code,,V32.00,1970-01-01,2099-12-31,
44830777,"Twin birth, mate stillborn, born in hospital, delivered by cesarean section",Condition,ICD9CM,5-dig billing V code,,V32.01,1970-01-01,2099-12-31,
44820415,"Twin birth, mate stillborn, born outside hospital and not hospitalized",Condition,ICD9CM,4-dig billing V code,,V32.2,1970-01-01,2099-12-31,
44831935,"Twin, unspecified, born in hospital",Condition,ICD9CM,4-dig nonbill V code,,V33.0,1970-01-01,2099-12-31,
44825000,"Twin birth, unspecified whether mate liveborn or stillborn, born in hospital, delivered without mention of cesarean section",Condition,ICD9CM,5-dig billing V code,,V33.00,1970-01-01,2099-12-31,
44826185,"Twin birth, unspecified whether mate liveborn or stillborn, born in hospital, delivered by cesarean section",Observation,ICD9CM,5-dig billing V code,,V33.01,1970-01-01,2099-12-31,
44820416,"Twin birth, unspecified whether mate liveborn or stillborn, born before admission to hospital",Condition,ICD9CM,4-dig billing V code,,V33.1,1970-01-01,2099-12-31,
44823819,"Twin birth, unspecified whether mate liveborn or stillborn, born outside hospital and not hospitalized",Condition,ICD9CM,4-dig billing V code,,V33.2,1970-01-01,2099-12-31,
44823820,"Other multiple birth (three or more), mates all liveborn, born in hospital, delivered without mention of cesarean section",Condition,ICD9CM,5-dig billing V code,,V34.00,1970-01-01,2099-12-31,
44822689,"Other multiple birth (three or more), mates all liveborn, born in hospital, delivered by cesarean section",Condition,ICD9CM,5-dig billing V code,,V34.01,1970-01-01,2099-12-31,
44830780,"Other multiple birth (three or more), mates all liveborn, born before admission to hospital",Condition,ICD9CM,4-dig billing V code,,V34.1,1970-01-01,2099-12-31,
44834266,"Other multiple birth (three or more), mates all still born, born in hospital, delivered without mention of cesarean section",Condition,ICD9CM,5-dig billing V code,,V35.00,1970-01-01,2099-12-31,
44820418,"Other multiple birth (three or more), mates all stillborn, born before admission to hospital",Condition,ICD9CM,4-dig billing V code,,V35.1,1970-01-01,2099-12-31,
44822691,"Other multiple birth (three or more), mates all stillborn, born outside of hospital and not hospitalized",Condition,ICD9CM,4-dig billing V code,,V35.2,1970-01-01,2099-12-31,
44828532,"Other multiple birth (three or more), mates liveborn and stillborn, born in hospital, delivered without mention of cesarean section",Condition,ICD9CM,5-dig billing V code,,V36.01,1970-01-01,2099-12-31,
44825001,"Other multiple birth (three or more), unspecified whether mates liveborn or stillborn, born in hospital, delivered without mention of cesarean section",Observation,ICD9CM,5-dig billing V code,,V37.00,1970-01-01,2099-12-31,
