concept_id,concept_name,domain_id,vocabulary_id,concept_class_id,standard_concept,concept_code,valid_start_date,valid_end_date,invalid_reason
44834267,"Other multiple birth (three or more), unspecified whether mates liveborn or stillborn, born in hospital, delivered by cesarean section",Condition,ICD9CM,5-dig billing V code,,V37.01,1970-01-01,2099-12-31,
44831938,"Other liveborn, unspecified, born in hospital",Observation,ICD9CM,4-dig nonbill V code,,V39.0,1970-01-01,2099-12-31,
44829629,"Liveborn, unspecified whether single, twin or multiple, born in hospital, delivered without mention of cesarean section",Observation,ICD9CM,5-dig billing V code,,V39.00,1970-01-01,2099-12-31,
44821540,"Liveborn, unspecified whether single, twin or multiple, born in hospital, delivered by cesarean section",Observation,ICD9CM,5-dig billing V code,,V39.01,1970-01-01,2099-12-31,
44829630,"Liveborn, unspecified whether single, twin or multiple, born before admission to hospital",Condition,ICD9CM,4-dig billing V code,,V39.1,1970-01-01,2099-12-31,
44837810,"Liveborn, unspecified whether single, twin or multiple, born outside hospital and not hospitalized",Condition,ICD9CM,4-dig billing V code,,V39.2,1970-01-01,2099-12-31,
44836656,Percutaneous transluminal coronary angioplasty status,Observation,ICD9CM,5-dig billing V code,,V45.82,1970-01-01,2099-12-31,
44825039,Residence remote from hospital or other health care facility,Observation,ICD9CM,4-dig billing V code,,V63.0,2002-10-01,2099-12-31,
2000007,Therapeutic ultrasound of heart,Procedure,ICD9Proc,4-dig billing code,S,00.02,2002-10-01,2099-12-31,
2000064,Percutaneous transluminal coronary angioplasty [PTCA],Procedure,ICD9Proc,4-dig billing code,,00.66,2005-10-01,2099-12-31,
2001500,Single vessel percutaneous transluminal coronary angioplasty [PTCA] or coronary atherectomy without mention of thrombolytic agent,Procedure,ICD9Proc,Procedure,S,36.01,1970-01-01,2014-09-30,
2001501,Single vessel percutaneous transluminal coronary angioplasty [PTCA] or coronary atherectomy with mention of thrombolytic agent,Procedure,ICD9Proc,Procedure,S,36.02,1970-01-01,2014-09-30,
2001502,Open chest coronary artery angioplasty,Procedure,ICD9Proc,4-dig billing code,,36.03,1970-01-01,2099-12-31,
2001504,"Multiple vessel percutaneous transluminal coronary angioplasty [PTCA] or coronary atherectomy performed during the same operation, with or without mention of thrombolytic agent",Procedure,ICD9Proc,Procedure,S,36.05,1970-01-01,2014-09-30,
2001505,Insertion of non-drug-eluting coronary artery stent(s),Procedure,ICD9Proc,4-dig billing code,,36.06,1970-01-01,2099-12-31,
2001506,Insertion of drug-eluting coronary artery stent(s),Procedure,ICD9Proc,4-dig billing code,,36.07,2002-10-01,2099-12-31,
2001543,Intracardiac echocardiography,Procedure,ICD9Proc,4-dig billing code,,37.28,1970-01-01,2099-12-31,
2006918,Diagnostic ultrasound of heart,Procedure,ICD9Proc,4-dig billing code,,88.72,1970-01-01,2099-12-31,
38004270,Epilepsy Hospital Unit,Visit,NUCC,Visit,S,273100000X,1970-01-01,2099-12-31,
38004274,Substance Use Disorder Rehabilitation Hospital Unit,Visit,NUCC,Visit,S,276400000X,1970-01-01,2099-12-31,
38004275,Chronic Disease Hospital Unit,Visit,NUCC,Visit,S,281P00000X,1970-01-01,2099-12-31,
38004276,Chronic Disease Children Hospital,Visit,NUCC,Visit,S,281PC2000X,1970-01-01,2099-12-31,
38004277,Long Term Care Hospital,Visit,NUCC,Visit,S,282E00000X,1970-01-01,2099-12-31,
38004278,Religious Nonmedical Health Care Institution,Visit,NUCC,Visit,S,282J00000X,1970-01-01,2099-12-31,
38004279,General Acute Care Hospital,Visit,NUCC,Visit,S,282N00000X,1970-01-01,2099-12-31,
38004280,General Acute Care Critical Access Hospital,Visit,NUCC,Visit,S,282NC0060X,1970-01-01,2099-12-31,
38004281,General Acute Care Children Hospital,Visit,NUCC,Visit,S,282NC2000X,1970-01-01,2099-12-31,
38004282,General Rural Acute Care Hospital,Visit,NUCC,Visit,S,282NR1301X,1970-01-01,2099-12-31,
38004283,General Acute Care Women Hospital,Visit,NUCC,Visit,S,282NW0100X,1970-01-01,2099-12-31,
38004284,Psychiatric Hospital,Visit,NUCC,Visit,S,283Q00000X,1970-01-01,2099-12-31,
38004285,Rehabilitation Hospital,Visit,NUCC,Visit,S,283X00000X,1970-01-01,2099-12-31,
38004286,Rehabilitation Children Hospital,Visit,NUCC,Visit,S,283XC2000X,1970-01-01,2099-12-31,
38004287,Special Hospital,Visit,NUCC,Visit,S,284300000X,1970-01-01,2099-12-31,
38004288,Military Hospital,Visit,NUCC,Visit,S,286500000X,1970-01-01,2099-12-31,
38004290,Military General Acute Care Hospital,Visit,NUCC,Visit,S,2865M2000X,1970-01-01,2099-12-31,
38004291,Military General Acute Care Operational (Transportable) Hospital,Visit,NUCC,Visit,S,2865X1600X,1970-01-01,2099-12-31,
38004311,Inpatient Hospice,Visit,NUCC,Visit,S,315D00000X,1970-01-01,2099-12-31,
3170433,Right coronary artery stent,Procedure,Nebraska Lexicon,Procedure,S,11940001000004108,2016-01-28,2099-12-31,
3181809,Angioplasty with placement circumflex stent,Procedure,Nebraska Lexicon,Procedure,S,16210001000004103,2016-01-28,2099-12-31,
3190422,Balloon angioplasty right coronary artery,Procedure,Nebraska Lexicon,Procedure,S,17000001000004105,2016-01-28,2099-12-31,
3188421,Percutaneous angioplasty of diagonal artery,Procedure,Nebraska Lexicon,Procedure,S,23070001000004106,2016-01-28,2099-12-31,
3186322,Placement of stent in proximal ramus artery,Procedure,Nebraska Lexicon,Procedure,S,27740001000004103,2016-01-28,2099-12-31,
3173558,Placement of stent in obtuse marginal branch artery,Procedure,Nebraska Lexicon,Procedure,S,27750001000004100,2016-01-28,2099-12-31,
3180695,Insertion of drug coated stent in proximal right coronary artery,Procedure,Nebraska Lexicon,Procedure,S,29570001000004106,2016-01-28,2099-12-31,
3195796,Abnormal dobutamine stress echocardiogram,Condition,Nebraska Lexicon,Clinical Finding,S,7410001000004104,2016-01-28,2099-12-31,
45763961,Bioabsorbable drug-eluting coronary artery stent,Device,SNOMED,Physical Object,S,700515002,2014-07-31,2099-12-31,
45763962,Nonbioabsorbable drug-eluting polymer coated coronary artery stent,Device,SNOMED,Physical Object,S,700516001,2014-07-31,2099-12-31,
45763963,Drug-eluting carbon-coated coronary artery stent,Device,SNOMED,Physical Object,S,700517005,2014-07-31,2099-12-31,
45771182,Antibody-coated drug-eluting coronary artery stent,Device,SNOMED,Physical Object,S,701548008,2014-07-31,2099-12-31,
45773302,Bioabsorbable drug-eluting polymer coated coronary artery stent,Device,SNOMED,Physical Object,S,701553003,2014-07-31,2099-12-31,
45766075,Acute anterior ST segment elevation myocardial infarction,Condition,SNOMED,Clinical Finding,S,703164000,2014-07-31,2099-12-31,
45766076,Acute ST segment elevation myocardial infarction of anterior wall involving right ventricle,Condition,SNOMED,Clinical Finding,S,703165004,2014-07-31,2099-12-31,
45766114,Subsequent ST segment elevation myocardial infarction,Condition,SNOMED,Clinical Finding,S,703211006,2014-07-31,2099-12-31,
45766116,Acute ST segment elevation myocardial infarction of inferior wall,Condition,SNOMED,Clinical Finding,S,703213009,2014-07-31,2099-12-31,
45766151,Acute ST segment elevation myocardial infarction of inferior wall involving right ventricle,Condition,SNOMED,Clinical Finding,S,703253007,2014-07-31,2099-12-31,
45773079,Stress echocardiography using dobutamine,Procedure,SNOMED,Procedure,S,703338002,2014-07-31,2099-12-31,
45766241,Subsequent non-ST segment elevation myocardial infarction,Condition,SNOMED,Clinical Finding,S,703360004,2014-07-31,2099-12-31,
45772824,Drug-eluting coronary artery stent,Device,SNOMED,Physical Object,S,705637003,2014-07-31,2099-12-31,
45767945,Coronary artery stent,Device,SNOMED,Physical Object,S,705643001,2014-07-31,2099-12-31,
45768093,Coronary angioplasty balloon catheter,Device,SNOMED,Physical Object,S,705926001,2014-07-31,2099-12-31,
45770937,Coronary angioplasty catheter,Device,SNOMED,Physical Object,S,705928000,2014-07-31,2099-12-31,
45769224,Percutaneous transluminal cutting balloon angioplasty of coronary artery,Procedure,SNOMED,Procedure,S,707828002,2015-01-31,2099-12-31,
46273020,Doppler fetal echocardiography,Procedure,SNOMED,Procedure,S,711490008,2015-07-31,2099-12-31,
46273033,Doppler transesophageal echocardiography,Procedure,SNOMED,Procedure,S,711507002,2015-07-31,2099-12-31,
37018743,Bioabsorbable non-drug-eluting coronary artery stent,Device,SNOMED,Physical Object,S,713937005,2016-01-31,2099-12-31,
36713465,Singleton liveborn born in hospital,Observation,SNOMED,Context-dependent,S,717803002,2017-01-31,2099-12-31,
36713466,Singleton liveborn born outside hospital,Observation,SNOMED,Context-dependent,S,717804008,2017-01-31,2099-12-31,
36717088,Focused transthoracic echocardiography in intensive care,Procedure,SNOMED,Procedure,S,719508009,2017-01-31,2099-12-31,
36714929,"Coronary angioplasty balloon catheter, drug-eluting",Device,SNOMED,Physical Object,S,720351003,2017-01-31,2099-12-31,
36715437,Drug-coated-metal coronary artery stent,Device,SNOMED,Pharma/Biol Product,S,721112008,2017-01-31,2099-12-31,
37111313,Placement of stent in coronary artery bypass graft,Procedure,SNOMED,Procedure,S,726011000,2017-07-31,2099-12-31,
4250325,Echocardiography for determining size of ventricular chambers,Procedure,SNOMED,Procedure,S,74193008,2002-01-31,2099-12-31,
1126454,"Service for diagnosis, evaluation, or treatment of a mental health or substance use disorder, initial 15-29 minutes, provided remotely by hospital staff who are licensed to provide mental health services under applicable state law(s), when the patient...",Procedure,HCPCS,HCPCS,S,C7900,2023-01-01,2099-12-31,
1126226,"Service for diagnosis, evaluation, or treatment of a mental health or substance use disorder, initial 30-60 minutes, provided remotely by hospital staff who are licensed to provided mental health services under applicable state law(s), when the patient...",Procedure,HCPCS,HCPCS,S,C7901,2023-01-01,2099-12-31,
2616263,"Transthoracic echocardiography with contrast, or without contrast followed by with contrast, for congenital cardiac anomalies; complete",Procedure,HCPCS,HCPCS,S,C8921,2008-01-01,2099-12-31,
2616264,"Transthoracic echocardiography with contrast, or without contrast followed by with contrast, for congenital cardiac anomalies; follow-up or limited study",Procedure,HCPCS,HCPCS,S,C8922,2008-01-01,2099-12-31,
2616265,"Transthoracic echocardiography with contrast, or without contrast followed by with contrast, real-time with image documentation (2d), includes m-mode recording, when performed, complete, without spectral or color doppler echocardiography",Procedure,HCPCS,HCPCS,S,C8923,2008-01-01,2099-12-31,
2616266,"Transthoracic echocardiography with contrast, or without contrast followed by with contrast, real-time with image documentation (2d), includes m-mode recording, when performed, follow-up or limited study",Procedure,HCPCS,HCPCS,S,C8924,2008-01-01,2099-12-31,
2616267,"Transesophageal echocardiography (tee) with contrast, or without contrast followed by with contrast, real time with image documentation (2d) (with or without m-mode recording); including probe placement, image acquisition, interpretation and report",Procedure,HCPCS,HCPCS,S,C8925,2008-01-01,2099-12-31,
2616268,"Transesophageal echocardiography (tee) with contrast, or without contrast followed by with contrast, for congenital cardiac anomalies; including probe placement, image acquisition, interpretation and report",Procedure,HCPCS,HCPCS,S,C8926,2008-01-01,2099-12-31,
2616269,"Transesophageal echocardiography (tee) with contrast, or without contrast followed by with contrast, for monitoring purposes, including probe placement, real time 2-dimensional image acquisition and interpretation leading to ongoing (continuous) assess...",Procedure,HCPCS,HCPCS,S,C8927,2008-01-01,2099-12-31,
2616270,"Transthoracic echocardiography with contrast, or without contrast followed by with contrast, real-time with image documentation (2d), includes m-mode recording, when performed, during rest and cardiovascular stress test using treadmill, bicycle exercis...",Procedure,HCPCS,HCPCS,S,C8928,2008-01-01,2099-12-31,
2616271,"Transthoracic echocardiography with contrast, or without contrast followed by with contrast, real-time with image documentation (2d), includes m-mode recording, when performed, complete, with spectral doppler echocardiography, and with color flow doppl...",Procedure,HCPCS,HCPCS,S,C8929,2009-01-01,2099-12-31,
2616272,"Transthoracic echocardiography, with contrast, or without contrast followed by with contrast, real-time with image documentation (2d), includes m-mode recording, when performed, during rest and cardiovascular stress test using treadmill, bicycle exerci...",Procedure,HCPCS,HCPCS,S,C8930,2009-01-01,2099-12-31,
43533247,"Percutaneous transcatheter placement of drug eluting intracoronary stent(s), with coronary angioplasty when performed; single major coronary artery or branch",Procedure,HCPCS,HCPCS,S,C9600,2013-01-01,2099-12-31,
43533352,"Percutaneous transcatheter placement of drug-eluting intracoronary stent(s), with coronary angioplasty when performed; each additional branch of a major coronary artery (list separately in addition to code for primary procedure)",Procedure,HCPCS,HCPCS,S,C9601,2013-01-01,2099-12-31,
43533353,"Percutaneous transluminal coronary atherectomy, with drug eluting intracoronary stent, with coronary angioplasty when performed; single major coronary artery or branch",Procedure,HCPCS,HCPCS,S,C9602,2013-01-01,2099-12-31,
43533248,"Percutaneous transluminal coronary atherectomy, with drug-eluting intracoronary stent, with coronary angioplasty when performed; each additional branch of a major coronary artery (list separately in addition to code for primary procedure)",Procedure,HCPCS,HCPCS,S,C9603,2013-01-01,2099-12-31,
43533186,"Percutaneous transluminal revascularization of or through coronary artery bypass graft (internal mammary, free arterial, venous), any combination of drug-eluting intracoronary stent, atherectomy and angioplasty, including distal protection when perform...",Procedure,HCPCS,HCPCS,S,C9604,2013-01-01,2099-12-31,
43533223,"Percutaneous transluminal revascularization of or through coronary artery bypass graft (internal mammary, free arterial, venous), any combination of drug-eluting intracoronary stent, atherectomy and angioplasty, including distal protection when perform...",Procedure,HCPCS,HCPCS,S,C9605,2013-01-01,2099-12-31,
43533187,"Percutaneous transluminal revascularization of acute total/subtotal occlusion during acute myocardial infarction, coronary artery or coronary artery bypass graft, any combination of drug-eluting intracoronary stent, atherectomy and angioplasty, includi...",Procedure,HCPCS,HCPCS,S,C9606,2013-01-01,2099-12-31,
43533354,"Percutaneous transluminal revascularization of chronic total occlusion, coronary artery, coronary artery branch, or coronary artery bypass graft, any combination of drug-eluting intracoronary stent, atherectomy and angioplasty; single vessel",Procedure,HCPCS,HCPCS,S,C9607,2013-01-01,2099-12-31,
43533242,"Percutaneous transluminal revascularization of chronic total occlusion, coronary artery, coronary artery branch, or coronary artery bypass graft, any combination of drug-eluting intracoronary stent, atherectomy and angioplasty; each additional coronary...",Procedure,HCPCS,HCPCS,S,C9608,2013-01-01,2099-12-31,
40217358,"Blinded procedure for nyha class iii/iv heart failure; transcatheter implantation of interatrial shunt or placebo control, including right heart catheterization, trans-esophageal echocardiography (tee)/intracardiac echocardiography (ice), and all imagi...",Procedure,HCPCS,HCPCS,S,C9758,2020-01-01,2099-12-31,
801209,"Non-randomized, non-blinded procedure for nyha class ii, iii, iv heart failure; transcatheter implantation of interatrial shunt, including right and left heart catheterization, transeptal puncture, trans-esophageal echocardiography (tee)/intracardiac e...",Procedure,HCPCS,HCPCS,S,C9760,2020-07-01,2099-12-31,
704057,"Hospital outpatient clinic visit specimen collection for severe acute respiratory syndrome coronavirus 2 (sars-cov-2) (coronavirus disease [covid-19]), any specimen source",Procedure,HCPCS,HCPCS,,C9803,2020-03-01,2099-12-31,
40663853,HOSPITAL CALL,Procedure,HCPCS,HCPCS,,D9420,1970-01-01,2011-01-09,D
2617342,Unscheduled or emergency dialysis treatment for an esrd patient in a hospital outpatient department that is not certified as an esrd facility,Procedure,HCPCS,HCPCS,,G0257,2003-01-01,2099-12-31,
2617369,"Transcatheter placement of a drug eluting intracoronary stent(s), percutaneous, with or without other therapeutic intervention, any method; single vessel (Deprecated)",Procedure,HCPCS,HCPCS,S,G0290,2003-01-01,2015-10-27,
2617370,"Transcatheter placement of a drug eluting intracoronary stent(s), percutaneous, with or without other therapeutic intervention, any method; each additional vessel (Deprecated)",Procedure,HCPCS,HCPCS,S,G0291,2003-01-01,2015-10-27,
2617460,Trauma response team associated with hospital critical care service,Observation,HCPCS,HCPCS,S,G0390,2007-01-01,2099-12-31,
40217289,"Documentation of medical reason(s) for not prescribing ace inhibitor or arb or arni therapy (e.g., hypotensive patients who are at immediate risk of cardiogenic shock, hospitalized patients who have experienced marked azotemia, allergy, intolerance, ot...",Observation,HCPCS,HCPCS,S,G2093,2020-01-01,2099-12-31,
40664882,"Antithrombotic therapy not prescribed for documented reasons (e.g., patient had stroke during hospital stay, patient expired during inpatient stay, other medical reason(s)); (e.g., patient left against medical advice, other patient reason(s)) (Deprecated)",Observation,HCPCS,HCPCS,S,G8697,2012-01-01,2017-12-31,
43533339,Patient documented not to have experienced any of the following events: a burn prior to discharge; a fall within the facility; wrong site/side/patient/procedure/implant event; or a hospital transfer or hospital admission upon discharge from the facility,Observation,HCPCS,HCPCS,S,G8907,2012-04-01,2099-12-31,
43533357,Patient documented to have experienced a hospital transfer or hospital admission upon discharge from asc,Observation,HCPCS,HCPCS,S,G8914,2012-04-01,2099-12-31,
43533364,Patient documented not to have experienced a hospital transfer or hospital admission upon discharge from asc,Observation,HCPCS,HCPCS,S,G8915,2012-04-01,2099-12-31,
43533197,"Transesophageal doppler measurement of cardiac output (including probe placement, image acquisition, and interpretation per course of treatment) for monitoring purposes",Procedure,HCPCS,HCPCS,S,G9157,2013-01-01,2099-12-31,
44786514,No unplanned hospital readmission within 30 days of principal procedure,Observation,HCPCS,HCPCS,S,G9309,2014-01-01,2099-12-31,
45890698,"Death, permanent nursing home resident or receiving hospice or palliative care any time during the measurement period (Deprecated)",Observation,HCPCS,HCPCS,S,G9433,2015-01-01,2015-12-31,
915647,Total number of emergency department visits and inpatient hospitalizations less than two in the past 12 months,Observation,HCPCS,HCPCS,,G9521,2016-01-01,2099-12-31,
915648,"Total number of emergency department visits and inpatient hospitalizations equal to or greater than two in the past 12 months or patient not screened, reason not given",Observation,HCPCS,HCPCS,,G9522,2016-01-01,2099-12-31,
915762,Transfer of care during an anesthetic or to the intensive care unit (Deprecated),Observation,HCPCS,HCPCS,S,G9657,2016-01-01,2016-12-31,
1314440,Hospitalized patients with newly diagnosed cva considered for endovascular stroke treatment,Observation,HCPCS,HCPCS,S,G9767,2017-01-01,2099-12-31,
1314486,Patient did not die within 30 days of the procedure or during the index hospitalization,Observation,HCPCS,HCPCS,S,G9813,2017-01-01,2099-12-31,
2618104,Alcohol and/or drug services; group counseling by a clinician,Procedure,HCPCS,HCPCS,,H0005,2001-01-01,2099-12-31,
2618105,Alcohol and/or drug services; case management,Procedure,HCPCS,HCPCS,,H0006,2001-01-01,2099-12-31,
2618106,Alcohol and/or drug services; crisis intervention (outpatient),Procedure,HCPCS,HCPCS,,H0007,2001-01-01,2099-12-31,
2618111,Alcohol and/or drug services; sub-acute detoxification (residential addiction program outpatient),Procedure,HCPCS,HCPCS,,H0012,2001-01-01,2099-12-31,
2618112,Alcohol and/or drug services; acute detoxification (residential addiction program outpatient),Procedure,HCPCS,HCPCS,,H0013,2001-01-01,2099-12-31,
2618113,Alcohol and/or drug services; ambulatory detoxification,Procedure,HCPCS,HCPCS,,H0014,2001-01-01,2099-12-31,
2618114,"Alcohol and/or drug services; intensive outpatient (treatment program that operates at least 3 hours/day and at least 3 days/week and is based on an individualized treatment plan), including assessment, counseling; crisis intervention, and activity the...",Procedure,HCPCS,HCPCS,,H0015,2001-01-01,2099-12-31,
2618115,Alcohol and/or drug services; medical/somatic (medical intervention in ambulatory setting),Procedure,HCPCS,HCPCS,,H0016,2001-01-01,2099-12-31,
2618116,"Behavioral health; residential (hospital residential treatment program), without room and board, per diem",Procedure,HCPCS,HCPCS,,H0017,2001-01-01,2099-12-31,
2618117,"Behavioral health; short-term residential (non-hospital residential treatment program), without room and board, per diem",Procedure,HCPCS,HCPCS,,H0018,2001-01-01,2099-12-31,
2618119,Alcohol and/or drug services; methadone administration and/or service (provision of the drug by a licensed program),Procedure,HCPCS,HCPCS,,H0020,2001-01-01,2099-12-31,
2618149,"Alcohol and/or drug services, brief intervention, per 15 minutes",Procedure,HCPCS,HCPCS,,H0050,2007-01-01,2099-12-31,
800973,"Intravenous injection, bebtelovimab, includes injection and post administration monitoring in the home or residence; this includes a beneficiary's home that has been made provider-based to the hospital during the covid-19 public health emergency",Drug,HCPCS,HCPCS,,M0223,2022-02-11,2099-12-31,
801194,"Intravenous infusion or subcutaneous injection, casirivimab and imdevimab includes infusion or injection, and post administration monitoring in the home or residence; this includes a beneficiary's home that has been made provider-based to the hospital...",Drug,HCPCS,HCPCS,,M0241,2021-07-30,2099-12-31,
801193,"Intravenous infusion or subcutaneous injection, casirivimab and imdevimab includes infusion or injection, and post administration monitoring in the home or residence; this includes a beneficiary's home that has been made provider-based to the hospital...",Drug,HCPCS,HCPCS,,M0244,2021-05-06,2099-12-31,
801191,"Intravenous infusion, bamlanivimab and etesevimab, includes infusion and post administration monitoring in the home or residence; this includes a beneficiary's home that has been made provider based to the hospital during the covid 19 public health eme...",Drug,HCPCS,HCPCS,,M0246,2021-05-06,2099-12-31,
801189,"Intravenous infusion, sotrovimab, includes infusion and post administration monitoring in the home or residence; this includes a beneficiary's home that has been made provider-based to the hospital during the covid-19 public health emergency",Drug,HCPCS,HCPCS,,M0248,2021-05-26,2099-12-31,
2720559,Travel allowance one way in connection with medically necessary laboratory specimen collection drawn from home bound or nursing home bound patient; prorated miles actually travelled,Observation,HCPCS,HCPCS,S,P9603,1987-01-01,2099-12-31,
2720560,Travel allowance one way in connection with medically necessary laboratory specimen collection drawn from home bound or nursing home bound patient; prorated trip charge,Observation,HCPCS,HCPCS,S,P9604,1987-01-01,2099-12-31,
2721013,"Partial hospitalization services, less than 24 hours, per diem",Observation,HCPCS,HCPCS,S,S0201,2002-10-01,2099-12-31,
2721015,"Paramedic intercept, non-hospital-based als service (non-voluntary), non-transport",Procedure,HCPCS,HCPCS,,S0207,2002-10-01,2099-12-31,
2721016,"Paramedic intercept, hospital-based als service (non-voluntary), non-transport",Procedure,HCPCS,HCPCS,,S0208,2002-01-01,2099-12-31,
2721125,"Bone marrow or blood-derived stem cells (peripheral or umbilical), allogeneic or autologous, harvesting, transplantation, and related complications; including: pheresis and cell preparation/storage; marrow ablative therapy; drugs, supplies, hospitaliza...",Procedure,HCPCS,HCPCS,S,S2150,2002-01-01,2099-12-31,
2721563,"Routine venipuncture for collection of specimen(s), single home bound, nursing home, or skilled nursing facility patient",Procedure,HCPCS,HCPCS,,S9529,2002-01-01,2099-12-31,
2721641,"Personal care services, per 15 minutes, not for an inpatient or resident of a hospital, nursing facility, icf/mr or imd, part of the individualized plan of treatment (code may not be used to identify services provided by home health aide or certified n...",Observation,HCPCS,HCPCS,S,T1019,2002-07-01,2099-12-31,
2721642,"Personal care services, per diem, not for an inpatient or resident of a hospital, nursing facility, icf/mr or imd, part of the individualized plan of treatment (code may not be used to identify services provided by home health aide or certified nurse a...",Observation,HCPCS,HCPCS,S,T1020,2002-07-01,2099-12-31,
1569127,ST elevation (STEMI) myocardial infarction of anterior wall,Condition,ICD10CM,4-char nonbill code,,I21.0,2012-01-01,2099-12-31,
45562340,ST elevation (STEMI) myocardial infarction involving left main coronary artery,Condition,ICD10CM,5-char billing code,,I21.01,1970-01-01,2099-12-31,
45572079,ST elevation (STEMI) myocardial infarction involving left anterior descending coronary artery,Condition,ICD10CM,5-char billing code,,I21.02,1970-01-01,2099-12-31,
45576865,ST elevation (STEMI) myocardial infarction involving other coronary artery of anterior wall,Condition,ICD10CM,5-char billing code,,I21.09,1970-01-01,2099-12-31,
